{"analysis_config":{"static_only":true,"target_format":"synthetic"},"artifact":{"format":"synthetic-placeholder","id":"artifact-1","origin":"synthetic test metadata","sha256":"0000000000000000000000000000000000000000000000000000000000000000","size":0},"disagreements":[],"engine_version":"0.1.0","errors":[],"evidence":[{"artifact_id":"artifact-1","id":"evidence-1","location":{"byte_range":null,"file_offset":null,"header_field":null,"instruction_range":null,"rva":null,"va":null},"method":"manual fixture","source":"synthetic field","verification_status":"pending"}],"inferences":[{"alternative_explanations":["It may be arbitrary text"],"description":"Marker may illustrate provenance links","id":"inference-1","inference_strength":"low","limitations":["No PE file was parsed"],"observation_ids":["observation-1"]}],"input_sha256":"0000000000000000000000000000000000000000000000000000000000000000","limitations":[{"code":"no_parser","description":"No parser ran; location is pending","id":"limitation-1","subject_id":"evidence-1"}],"observations":[{"description":"Synthetic marker is declared in fixture metadata","evidence_ids":["evidence-1"],"id":"observation-1","observation_confidence":"high"}],"parser_versions":{},"schema_version":"1.0.0","warnings":[]}
